{
	"task":"replace_embedded_manifest_assets",
	"image_processing":
	{
		"match_original_image_dimensions":true,
		"resize_mode":"contain",
		"skip_resize_if_dimensions_already_match":true
	},
	"operation":
	{
		"preserve_replacement_format":true
	},
	"replacements":
	[
		{
			"asset_type":"text",
			"replacement_search":"/var\\sTEST\\s=\\s.*;/gm",
			"replacement_text":"var TEST = true;"
		},
		{
			"asset_id":"bg",
			"asset_type":"image",
			"replacement_image":"new_bg.jpg",
			"parents":
			[
				
			]
		}
	],
	"output":
	{
		"type":"html",
		"filename_suffix":"_assets_replaced"
	}
}